{
  "schemaVersion": "public-promotion-package.v1",
  "releaseId": "mcp-pb-20260807t170627z-b091465c68ff",
  "approvalDigest": "sha256:12eeb45aebfc2c3f5becfa4be86a0642b74ac679bca77dcde0d6d676bcd0b22e",
  "files": [
    {
      "path": "articles/best-2-5gb-ethernet-adapters/index.html",
      "bytes": 48415,
      "sha256": "sha256:1c445d30da74136679bdc0257287b8408668c742baa864b535f0bfbfcdfd71ca"
    },
    {
      "path": "articles/best-drawing-tablets/index.html",
      "bytes": 48302,
      "sha256": "sha256:19c331c632140e5d4e388cb19437613d18a9c5f9dc601ed84344517b5f7d352a"
    },
    {
      "path": "articles/best-ethernet-cables/index.html",
      "bytes": 49100,
      "sha256": "sha256:c8251a643b9ec2284ca8162ed84ffb4db01bd30f34fc2ee7a8f11aaf8e789b8d"
    },
    {
      "path": "articles/best-nas-hard-drives/index.html",
      "bytes": 49440,
      "sha256": "sha256:01974751c3404f9654442a408401449bacf1ad4e0fb9dbed7fc27f2cfa2533b0"
    },
    {
      "path": "articles/best-smart-displays/index.html",
      "bytes": 48993,
      "sha256": "sha256:d6c136f0260a354f8cc1f8780a1ae80633908c43b68079aaf52f4ba1b9b0a227"
    },
    {
      "path": "articles/best-smart-smoke-carbon-monoxide-alarms/index.html",
      "bytes": 51026,
      "sha256": "sha256:6753f12f3ee96810d16b88bbb4eac6806fef634842d3592c1e816610c8baedee"
    },
    {
      "path": "articles/best-smart-speakers/index.html",
      "bytes": 49000,
      "sha256": "sha256:5ac0ef6cd7fe753974c27edf3a3941b2ca1608fd6a64ea36764e4bbf95de1456"
    },
    {
      "path": "articles/best-smart-water-leak-sensors/index.html",
      "bytes": 49904,
      "sha256": "sha256:553009fe8cd97f6225a3640679aae4f7bc26dbd1e18ad798eadf7305dc69e5fd"
    },
    {
      "path": "articles/best-travel-routers/index.html",
      "bytes": 48979,
      "sha256": "sha256:d27a6bc64e0f2f3298624e39f3358bc99d72536eeac165965514ff1df3c8d7d0"
    },
    {
      "path": "articles/best-wifi-adapters-desktop-pcs/index.html",
      "bytes": 47366,
      "sha256": "sha256:71aa7a5715b5a0b29f03df395a4e89921077a2cd97307e6fdf5af1a6ce86ff84"
    },
    {
      "path": "articles/index.html",
      "bytes": 293878,
      "sha256": "sha256:220540dae4eac1110169af9de317a84e86bb48da0d42750e8528020651e7545d"
    },
    {
      "path": "feed.xml",
      "bytes": 23058,
      "sha256": "sha256:61a281aa5b087f17a8613109de1909af0220bfbbbaf879c37f3553beb25e8edd"
    },
    {
      "path": "home/cleaning/index.html",
      "bytes": 39202,
      "sha256": "sha256:b64978e0f189b4d69e6a6ead9c6cc892b057e1bee0a586e1650d647699a3a882"
    },
    {
      "path": "home/heating-cooling/index.html",
      "bytes": 46301,
      "sha256": "sha256:1181897efe42a13ab3e32cf9a5e8cb3efeb4c777658fcb6f5f964d7a9cf92d5c"
    },
    {
      "path": "home/repairs-maintenance/index.html",
      "bytes": 49955,
      "sha256": "sha256:d6d83edd4f64071ee891269977b69024c7fd968b370ec5338e87b2cf4812d648"
    },
    {
      "path": "home/utilities-energy/index.html",
      "bytes": 43540,
      "sha256": "sha256:f5ec69b5a0b0666674c668a7a9469c54d9e506868fbffee9b8c0a3e58deef419"
    },
    {
      "path": "home-tech/computers-laptops/index.html",
      "bytes": 62473,
      "sha256": "sha256:65e4473d6043fe88d0ee12be6b99dcfd4c6b7a27cc4c3b4a9f37deaffff0b428"
    },
    {
      "path": "home-tech/index.html",
      "bytes": 206498,
      "sha256": "sha256:418d1e8990f34780e01cee080368a6a4f43b60599757c29a13001f7d22ffe5ee"
    },
    {
      "path": "home-tech/power-cooling-storage/index.html",
      "bytes": 51320,
      "sha256": "sha256:2f0ef588fad8a854827500dd001dfb66bb9cccf8d43329c140c9a3d9b9614560"
    },
    {
      "path": "home-tech/privacy-security/index.html",
      "bytes": 38226,
      "sha256": "sha256:b51bc897a29bbf490fc06f43b35276192aff7ec8e6449b127f1442ea63303684"
    },
    {
      "path": "home-tech/smart-home/index.html",
      "bytes": 42491,
      "sha256": "sha256:f49df7dec0a99b0c25cefc714dc29a7688855051d62f876f12e3b32e44cd5d18"
    },
    {
      "path": "home-tech/tvs-streaming/index.html",
      "bytes": 35275,
      "sha256": "sha256:35de87aa0cfc213517385fd271e080c812c322398883b7d77b3d703c8a0400a5"
    },
    {
      "path": "home-tech/wifi-routers/index.html",
      "bytes": 47972,
      "sha256": "sha256:78c15ad17b4152cc4bd9369a130b04c00664542a9f6cbff9b16b91eed1c63c1e"
    },
    {
      "path": "index.html",
      "bytes": 97373,
      "sha256": "sha256:834f5b2d48d4a4f310a1d633dc8905df9f5b8bb6aacb1eb6460e0ae845558619"
    },
    {
      "path": "kitchen/food-science/index.html",
      "bytes": 52615,
      "sha256": "sha256:7ba9a74d74597032874f1b08dd4e297446489510a99fef3880e555851ead09b8"
    },
    {
      "path": "kitchen/kitchen-appliances/index.html",
      "bytes": 40613,
      "sha256": "sha256:ac8bd83f75fa2afe8654744cb49375f9069a0b7902f46c34b40f7ae87d90c4a1"
    },
    {
      "path": "kitchen/troubleshooting-safety/index.html",
      "bytes": 55124,
      "sha256": "sha256:0fa2a748a1387e0b67870d3262b4c6bb9eb487ef0f5632a11cc3315b7276ea37"
    },
    {
      "path": "llms.txt",
      "bytes": 119231,
      "sha256": "sha256:a7e35ad3d5d953495312321c5df7e45674d2a1dee6741aaec471f0c3bf856b2d"
    },
    {
      "path": "pagefind/filter/en_1591834.pf_filter",
      "bytes": 861,
      "sha256": "sha256:7b1db3ae3a313f5b691c105acd7dd002d8f993708b6c681f772abf6ce7fa13da"
    },
    {
      "path": "pagefind/filter/en_eef40ac.pf_filter",
      "bytes": 827,
      "sha256": "sha256:f2091a4bfc44f33d31b1c85c0c78ac046e403637ef49b2b0b23dcc772567bf3c"
    },
    {
      "path": "pagefind/fragment/en_173b3e2.pf_fragment",
      "bytes": 3404,
      "sha256": "sha256:c71dc32f3002f268ea78b2c3e159c3cda11e719a7a30e96763d798b91e4312a0"
    },
    {
      "path": "pagefind/fragment/en_1940134.pf_fragment",
      "bytes": 3309,
      "sha256": "sha256:e6a03ed4a864de72231b0f49a08451a5921d59498028e7a174ebf8fe7354f09f"
    },
    {
      "path": "pagefind/fragment/en_217835d.pf_fragment",
      "bytes": 3516,
      "sha256": "sha256:064a2baad78a094d1ce16689ec75c1f5b38ccaf7b15cecfa09da70b877219d23"
    },
    {
      "path": "pagefind/fragment/en_21cab1a.pf_fragment",
      "bytes": 3449,
      "sha256": "sha256:c027e3f0dd1e0fea95918a77d02a9eff96bf1e619f7a2801bd8f88570a8af9e2"
    },
    {
      "path": "pagefind/fragment/en_22a9708.pf_fragment",
      "bytes": 4411,
      "sha256": "sha256:b5821144c26955aad921a3f201b19d7e87114a3aa5524d97a57faf485f704151"
    },
    {
      "path": "pagefind/fragment/en_246eb65.pf_fragment",
      "bytes": 3486,
      "sha256": "sha256:b31c2b7e6ec1e2c9f79aa17dfa1603aad0457c08e30c8f5fe2691ec0aa17f4ed"
    },
    {
      "path": "pagefind/fragment/en_367ba45.pf_fragment",
      "bytes": 3418,
      "sha256": "sha256:187763dcb6c64c87aba06e292742c8e55c5a48ba7466831ec41cb164167d5c1a"
    },
    {
      "path": "pagefind/fragment/en_5abc87b.pf_fragment",
      "bytes": 31094,
      "sha256": "sha256:477cb881d6f400fe88d478ed7d2a3790095c59e639d121d705da47f1d8ea21b1"
    },
    {
      "path": "pagefind/fragment/en_6a4a944.pf_fragment",
      "bytes": 16646,
      "sha256": "sha256:784e84b854d53a0f6d11c595a8621be29befd22d44d446b09aaafe80ed7e2bef"
    },
    {
      "path": "pagefind/fragment/en_89c7dc5.pf_fragment",
      "bytes": 2707,
      "sha256": "sha256:8120bcbc81d27feeff2e8f71a400a12cd5f5da294dadc6b89be656edc305caa0"
    },
    {
      "path": "pagefind/fragment/en_9a1272f.pf_fragment",
      "bytes": 3488,
      "sha256": "sha256:82a03b2e1025df76f1667caabf697d8d93a73f16ff1ef6b0c113f01d0ac87db0"
    },
    {
      "path": "pagefind/fragment/en_a02c1b1.pf_fragment",
      "bytes": 3649,
      "sha256": "sha256:0f3e3a9186ff0465b00f83dcce9e7147aceef6f809a7fb45f5730fe5f1061015"
    },
    {
      "path": "pagefind/fragment/en_a2b2123.pf_fragment",
      "bytes": 1573,
      "sha256": "sha256:93aa02b3bdf831ee8bad235ff131a16b5aaae9aa2f15b9a1c4f681a46aad0138"
    },
    {
      "path": "pagefind/fragment/en_e3dc888.pf_fragment",
      "bytes": 3615,
      "sha256": "sha256:9f1d30884bdc3dffabf9247b8295b724c635acb0da0f865c343958aafa67d36a"
    },
    {
      "path": "pagefind/fragment/en_ed6d785.pf_fragment",
      "bytes": 3483,
      "sha256": "sha256:2489bafc541b617e205ba0e97e286eb5c38a7120c58004c7a38d66a1087f10a7"
    },
    {
      "path": "pagefind/fragment/en_f567fe8.pf_fragment",
      "bytes": 11215,
      "sha256": "sha256:81a60ed6c14b2445a2489b6e22c3061f894d7a51cb437648640e6c4a5fe1fee4"
    },
    {
      "path": "pagefind/index/en_19f544d.pf_index",
      "bytes": 30474,
      "sha256": "sha256:2e0e8861320a0c8ae3a57bb7add32787a9604a0fe8d4e868eb047629b09244ec"
    },
    {
      "path": "pagefind/index/en_226fd99.pf_index",
      "bytes": 26965,
      "sha256": "sha256:29f3034c886a09017fa26104eb5008cbabce0c7fb773add55c173a439248dced"
    },
    {
      "path": "pagefind/index/en_234d5c2.pf_index",
      "bytes": 30873,
      "sha256": "sha256:9af66db6dc70922350ebedfc6d8054b161db5b2bb3a085579aaff9d352365127"
    },
    {
      "path": "pagefind/index/en_26b549f.pf_index",
      "bytes": 47545,
      "sha256": "sha256:5f58ffbf75db549cf3ce77d3c2598d80ff098e67dc7c55f5ac3f7281eb2e61f0"
    },
    {
      "path": "pagefind/index/en_2d6198d.pf_index",
      "bytes": 30611,
      "sha256": "sha256:d7e4f91fc127ded6c89eb6baf0283c3e3931ec6adc63d3d083370b6fce5769ad"
    },
    {
      "path": "pagefind/index/en_2d673e2.pf_index",
      "bytes": 28893,
      "sha256": "sha256:dd1ce8afb61297994da84ac72d1bf19dc7832c2a2dcecb6bb2d5358ac767f1cd"
    },
    {
      "path": "pagefind/index/en_2f6fadb.pf_index",
      "bytes": 28740,
      "sha256": "sha256:11ee4a9cc3d98cccfeae0a04641902181baf55c850b9bf0cfe112b688ecfa488"
    },
    {
      "path": "pagefind/index/en_36ae9eb.pf_index",
      "bytes": 28631,
      "sha256": "sha256:0bcaee9ea2d45578f449a070b6ce786387e8534694661626fdcc0a89a1a9aedc"
    },
    {
      "path": "pagefind/index/en_3d6ca88.pf_index",
      "bytes": 28253,